{
  "kind": "a3_operator_graph_manifest",
  "manifest_id": "a3-native-operator-graph-capability-v1",
  "description": "Minimal capability pilot only: one small train-side shape per operator (RMSNorm T8,H5120; SwiGLU T8,F2048; copy rows8,row_bytes1024), N=1, all three timing modes, 2 trials x 30 samples. It covers all three callables and both graph protocols but is NOT the full 54-condition matrix and does not make the T512 or N=32/128 claims.",
  "protocol": {
    "warmup_iterations": 10,
    "trials": 2,
    "samples_per_condition": 30,
    "seed": 20261021,
    "reference": {
      "rtol": 0.02,
      "atol": 0.02,
      "rstd_rtol": 0.02,
      "rstd_atol": 0.02
    },
    "budgets_seconds": {
      "case": 24,
      "global_work": 1200,
      "setup": 60,
      "cleanup": 120
    }
  },
  "expectations": {
    "protocol_conditions": 9,
    "raw_blocks": 540
  },
  "cases": [
    {
      "case_id": "rmsnorm-bf16-t8-h5120",
      "operator": "rms_norm",
      "dtype": "bfloat16",
      "layout": "contiguous",
      "shape": {
        "tokens": 8,
        "hidden": 5120
      },
      "epsilon": 1e-06,
      "ns": [
        1
      ],
      "modes": [
        "eager_block",
        "graph_single_repeated",
        "graph_block"
      ],
      "data": {
        "seed": 1101,
        "input_low": -1.0,
        "input_high": 1.0,
        "gamma_low": 0.5,
        "gamma_high": 1.5
      }
    },
    {
      "case_id": "swiglu-bf16-t8-f2048",
      "operator": "swiglu",
      "dtype": "bfloat16",
      "layout": "contiguous",
      "shape": {
        "tokens": 8,
        "ffn": 2048
      },
      "ns": [
        1
      ],
      "modes": [
        "eager_block",
        "graph_single_repeated",
        "graph_block"
      ],
      "data": {
        "seed": 2101,
        "input_low": -1.5,
        "input_high": 1.5
      }
    },
    {
      "case_id": "copy-uint8-rows8-row-bytes1024",
      "operator": "copy",
      "dtype": "uint8",
      "layout": "contiguous",
      "shape": {
        "rows": 8,
        "row_bytes": 1024
      },
      "ns": [
        1
      ],
      "modes": [
        "eager_block",
        "graph_single_repeated",
        "graph_block"
      ],
      "data": {
        "seed": 3101
      }
    }
  ]
}
